Search Term,Date,Title,Country,Description,URL
site:instagram.com #indigenousentrepreneurship,Unknown,Pow Wow Pitch is proud to continue our partnership with ... - Instagram,ca," 1 day ago  ·  Together, we're championing Indigenous entrepreneurship and reinforcing Pow Wow Pitch's mission to provide the resources, mentorship, and ... ",https://www.instagram.com/pow_wow_pitch/p/DHTdaCPOZp-/
site:instagram.com #indigenousentrepreneurship,"Jan 31, 2025",Wow! So proud to be a nominee for Indigenous Entrepreneur of the ...,ca," Jan 31, 2025  ·  Wow! So proud to be a nominee for Indigenous Entrepreneur of the Year. Thank you to CanadianSME for the recognition. @canadiansme ",https://www.instagram.com/sriracharevolver/p/DFgeC5tyiMC/
site:instagram.com #indigenousentrepreneurship,"Mar 5, 2025",We are thrilled to announce @rbc's return as a Co ... - Instagram,ca," Mar 5, 2025  ·  Together, we're empowering Indigenous entrepreneurs to create lasting impact in their communities. Learn more about our partnership at ... ",https://www.instagram.com/pow_wow_pitch/p/DG0mEoPOnoy/
site:instagram.com #indigenousentrepreneurship,"Feb 6, 2025",Are you passionate about Indigenous entrepreneurship? Pow Wow ...,ca," Feb 6, 2025  ·  Join our Team and help us scale our support for Indigenous entrepreneurs. Applications close on Friday, February 21, 2025. Learn more and apply ... ",https://www.instagram.com/pow_wow_pitch/p/DFvkIaVyhng/
site:instagram.com #indigenousentrepreneurship,"Mar 4, 2025",Celebrating 10 Years of Empowering Indigenous Entrepreneurs ...,ca," Mar 4, 2025  ·  Are you passionate about Indigenous entrepreneurship? Pow Wow Pitch is hiring! We're looking for: ",https://www.instagram.com/pow_wow_pitch/reel/DGyRYl5PdXq/
site:instagram.com #indigenousentrepreneurship,"Nov 1, 2024",Schulich School of Business on Instagram,ca," Nov 1, 2024  ·  From community-driven initiatives to social entrepreneurship, discover how Indigenous Canadians are revitalizing Canada's business landscape ... ",https://www.instagram.com/schulichschool/p/DB15BlDuesR/
site:instagram.com #indigenousentrepreneurship,"Jan 14, 2025",Indigenous Prosperity Foundation on Instagram,ca," Jan 14, 2025  ·  Calling all Indigenous entrepreneurs! Your journey has the power to inspire others. The Indigenous Prosperity Foundation, in partnership ... ",https://www.instagram.com/indigenousprosperity/p/DEz6L21p2NR/-calling-all-indigenous-entrepreneurs-your-journey-has-the-power-to-inspire-othe/
site:instagram.com #indigenousentrepreneurship,"Feb 21, 2025",Kebaonish tea and coffee is proudly made in Canada ... - Instagram,ca," Feb 21, 2025  ·  Kebaonish tea and coffee is proudly made in Canada. As an Indigenous and woman-owned business, we believe in the power of supporting our ... ",https://www.instagram.com/kebaonish/p/DGWCxn2yaKV/
site:instagram.com #indigenousentrepreneurship,"Mar 3, 2025","Treaty One on Instagram: ""REQUEST FOR PROPOSAL: LOGO ...",ca," Mar 3, 2025  ·  WTEC empowers Indigenous entrepreneurs nationwide by providing training, resources, and access to global markets, fostering economic growth and ... ",https://www.instagram.com/treatyone/p/DGvp2e3JphL/
site:instagram.com #indigenousentrepreneurship,Unknown,What makes our Kebaonish Gift Boxes truly special? Each one is ...,ca, 5 days ago  ·  What makes our Kebaonish Gift Boxes truly special? Each one is adorned with exclusive Indigenous artwork that brings vibrant designs to life ... ,https://www.instagram.com/kebaonish/p/DHJNPSFtOMr/
site:instagram.com #indigenousentrepreneurship,Unknown,Feeling lucky today with our Moringa Green Tea #Kebaonish ...,ca, 1 day ago  ·  What makes our Kebaonish Gift Boxes truly special? Each one is adorned with exclusive Indigenous artwork that brings vibrant designs to life ... ,https://www.instagram.com/kebaonish/p/DHTuXDbyH4R/
site:instagram.com #indigenousentrepreneurship,"Dec 18, 2024",A heartfelt thank you to everyone who attended our Indigenous ...,ca," Dec 18, 2024  ·  We are beyond grateful for the incredible turnout, with an estimated 600 people joining us to support local Indigenous creators, artisans and entrepreneurs. ",https://www.instagram.com/wampumlearninglodge/p/DDuyzLoxWvx/
site:instagram.com #indigenousentrepreneurship,"Nov 19, 2024",Shipping globally as an Indigenous entrepreneur? Todd Evans ...,ca," Nov 19, 2024  ·  Are you passionate about Indigenous entrepreneurship? Pow Wow Pitch is hiring! We're looking for: ",https://www.instagram.com/pow_wow_pitch/reel/DCjk4MNNG_P/
site:instagram.com #indigenousentrepreneurship,"Feb 22, 2025",Kebaonish Inc. on Instagram,ca," Feb 22, 2025  ·  Kebaonish tea and coffee is proudly made in Canada. As an Indigenous and woman-owned business, we believe in the power of supporting our ... ",https://www.instagram.com/kebaonish/p/DGYuuPRSaDA/
site:instagram.com #indigenousentrepreneurship,"Jan 23, 2024",We're in our era of #indigenousjoy as a lifestyle! On Creator this life ...,ca," Jan 23, 2024  ·  We're in our era of #indigenousjoy as a lifestyle! On Creator this life is good. Thankful for the lessons thankful for the gifts. ",https://www.instagram.com/indi_city/p/C2dkJ1JPL_z/
site:instagram.com #indigenousentrepreneurship,"Jan 31, 2025",更多,ca," Jan 31, 2025  ·  Wow! So proud to be a nominee for Indigenous Entrepreneur of the Year. Thank you to CanadianSME for the recognition. @canadiansme ",https://www.instagram.com/sriracharevolver/p/DFgeC5tyiMC/?api=Top%2Bpartners%E2%9C%85Safe.%2BSecure.%2BTransferable.%2BYour%2Bmoney%2Bremains%2Byour%2Bmoney.%2BWe%2Bsafeguard%2Bthat%2Bat%2BCrest..lucw&hl=zh-cn
site:instagram.com #indigenousentrepreneurship,"Feb 11, 2025",On behalf of the women of Women Helping Women ... - Instagram,ca," Feb 11, 2025  ·  It's the perfect opportunity to support Indigenous entrepreneurship while finding one-of-a-kind treasures. Let's celebrate and uplift our local ... ",https://www.instagram.com/p/DF84YqTM93Q/
site:instagram.com #indigenousentrepreneurship,"Apr 8, 2024",Thanks so much to @flint_hub for featuring me on your podcast ...,ca," Apr 8, 2024  ·  Ain't always just about the party in the back link can be found in their bio! . . #indigenous #indigenousentrepreneur # ... ",https://www.instagram.com/bskinnerr/p/C5gzPH8x4eW/
site:instagram.com #indigenousentrepreneurship,"May 16, 2024",more - Instagram,ca," May 16, 2024  ·  Join our Team and help us scale our support for Indigenous entrepreneurs. Applications close on Friday, February 21, 2025. Learn more and apply ... ",https://www.instagram.com/pow_wow_pitch/p/C7CDU6wrsY0/
site:instagram.com #indigenousentrepreneurship,"Apr 8, 2024",more - Instagram,ca," Apr 8, 2024  ·  ✨ This collaboration signifies a milestone in our mission to empower Indigenous entrepreneurs and foster economic growth within Indigenous ... ",https://www.instagram.com/pow_wow_pitch/p/C5gkeoUrbah/
site:instagram.com #indigenousentrepreneurship,"Jun 20, 2024",Christa Bruneau-Guenther shares her #IndigenousEntrepreneurship ...,ca," Jun 20, 2024  ·  Christa Bruneau-Guenther shares her #IndigenousEntrepreneurship story on how connecting to her culture through food helped heal her past ... ",https://www.instagram.com/experiencescanada/reel/C8c0GJ1PVGP/
site:instagram.com #indigenousentrepreneurship,"Feb 19, 2025",Repost: Kukwstsétsemc for the opportunity to share my ... - Instagram,ca," Feb 19, 2025  ·  When you shop 4 Generations Creation, you are actively participating in the Economic reconciliation and prosperity of Indigenous artists, ... ",https://www.instagram.com/4generationscreations/p/DGRQqDiTQyi/
site:instagram.com #indigenousentrepreneurship,"Dec 3, 2024",Kebaonish Inc. on Instagram,ca," Dec 3, 2024  ·  10 likes, 1 comments - kebaonish on December 3, 2024: ""  ✨ Discover Thoughtful Gifting with Kebaonish Inc.! ✨   Join Shyra Barberstock ... ",https://www.instagram.com/kebaonish/reel/DDHbo_hOmUq/
site:instagram.com #indigenousentrepreneurship,"Dec 2, 2020",#Sponsored I love working for myself and being an entrepreneur. It ...,ca," Dec 2, 2020  ·  Indigenous entrepreneurs from coast-to-coast pitch their business ideas and 125 finalists are selected to working one-on-one with a business ... ",https://www.instagram.com/urbannativegirl/p/CIUYGnuFIK3/?locale=es&hl=en
site:instagram.com #indigenousentrepreneurship,"Sep 23, 2024","Indigenomics on Instagram: ""   LIVE NOW: Breakout sessions ...",ca," Sep 23, 2024  ·  -Innovative businesses and investments -Policies driving economic reconciliation -Success stories that showcase Indigenous economic strength ",https://www.instagram.com/indigenomics/p/DARerrfzTTh/
