Search Term,Date,Title,Country,Description,URL
site:instagram.com #economicreconciliation,"Mar 4, 2025",Invest in Economic Reconciliation – Become an Indigenomics ...,ca," Mar 4, 2025  ·  “Breaking free from Indian Act economics requires systemic change, investment in Indigenous-led businesses, and a shift away from policies ... ",https://www.instagram.com/indigenomics/p/DGyeztkTVLx/
site:instagram.com #economicreconciliation,"Mar 3, 2025",What does it mean to build generational impact? How do ... - Instagram,ca," Mar 3, 2025  ·  These critical panels will explore how economic reconciliation is being activated through corporate leadership, Indigenous-led conservation ... ",https://www.instagram.com/indigenomics/p/DGwHL0mJYh3/
site:instagram.com #economicreconciliation,"Jan 30, 2025","Indigenomics on Instagram: ""It's time to recognize the power ...",ca," Jan 30, 2025  ·  Join us this April at the HR MacMillan Space Centre in Vancouver, where we will highlight stories of Indigenous economic reconciliation outcomes ... ",https://www.instagram.com/indigenomics/p/DFd4AV5Pvl1/
site:instagram.com #economicreconciliation,"Mar 10, 2025",Indigenomics IMPACT experience is an immersive ... - Instagram,ca," Mar 10, 2025  ·  Indigenomics IMPACT experience is an immersive journey into Indigenous economic reconciliation. Through XR storytelling, digital landscapes, ... ",https://www.instagram.com/indigenomics/p/DHB-YpOpoQm/
site:instagram.com #economicreconciliation,"Jan 21, 2025",The Indigenomics Institute is thrilled to invite leading ... - Instagram,ca," Jan 21, 2025  ·  Build meaningful partnerships with Indigenous leaders, businesses, and communities to advance economic reconciliation in tangible ways. Join ... ",https://www.instagram.com/indigenomics/p/DFGYhuOJUuy/
site:instagram.com #economicreconciliation,"Jun 12, 2024","Indigenomics on Instagram: """" The source of poverty is twofold. First ...",ca," Jun 12, 2024  ·  -Policies driving economic reconciliation -Success stories that showcase Indigenous economic strength. This is where Indigenous-led solutions, ... ",https://www.instagram.com/indigenomics/p/C8H7mNtAgaC/
site:instagram.com #economicreconciliation,"Oct 11, 2024","Get ready—in just 4 days, the $100 Billion Indigenous economy ...",ca," Oct 11, 2024  ·  This is where economic reconciliation takes action. Over two transformative days, we will spotlight: -Groundbreaking Indigenous partnerships - ... ",https://www.instagram.com/indigenomics/p/DA_se8Ozxfn/
site:instagram.com #economicreconciliation,"Jan 30, 2025","Indigenomics on Instagram: ""The Indigenous economy is rising ...",ca," Jan 30, 2025  ·  -Hands-on innovation in economic reconciliation -Strengthening Indigenous economic growth & design -A creative space for organizations to build ... ",https://www.instagram.com/indigenomics/p/DFdgTBppWR2/
site:instagram.com #economicreconciliation,"Jan 21, 2025",“It's time for the fire of Indigenous economic justice to ... - Instagram,ca," Jan 21, 2025  ·  Economic justice means recognizing our inherent rights, fostering economic reconciliation, and creating pathways for economic sovereignty that ... ",https://www.instagram.com/hesquiaht/p/DFGkN2zTDdP/
site:instagram.com #economicreconciliation,"Sep 28, 2023",the Economic Reconciliation Showcase at the upcoming ... - Instagram,ca," Sep 28, 2023  ·  Our speakers are activating economic reconciliation, advancing Indigenous business, and designing innovative solutions for long-term prosperity. ",https://www.instagram.com/indigenomics/p/CxvrLwqpXIq/
site:instagram.com #economicreconciliation,"May 30, 2024",1⃣Decolonize the economy 2⃣Be vigilant against pretendians ...,ca," May 30, 2024  ·  Three principles of #EconomicReconciliation: 1⃣Decolonize the economy 2⃣Be vigilant against pretendians - strengthen program standards ",https://www.instagram.com/cincindy99/p/C7m_hcsAta5/
site:instagram.com #economicreconciliation,"Sep 15, 2024",The truth behind 'Economic Reconciliation'. - Instagram,ca," Sep 15, 2024  ·  340 likes, 0 comments - gitanyowchiefs on September 15, 2024: ""The truth behind 'Economic Reconciliation'. ",https://www.instagram.com/gitanyowchiefs/reel/C_8vcAsSh1t/
site:instagram.com #economicreconciliation,"Feb 28, 2025",The Métis National Council had a successful few days ... - Instagram,ca," Feb 28, 2025  ·  The Métis National Council had a successful few days meeting with key partners to advocate for long-term commitments to bolster Métis ... ",https://www.instagram.com/metisnationalcouncil/p/DGoewS_vbHX/
site:instagram.com #economicreconciliation,"Dec 3, 2024","The latest episode, Forestry Talks, is here! In this conversation, John ...",ca," Dec 3, 2024  ·  Click the link in our bio and head to watch the full episode. #ForestryTalks #IndigenousLeadership #Sustainability #EconomicReconciliation. 更多. ",https://www.instagram.com/albertaforests/p/DDH5WmONftI/?api=WhatsApp%E8%87%AA%E5%8A%A8%E5%8C%96%E5%BC%95%E6%B5%81%F0%9F%A7%A7-[%E8%AE%A4%E5%87%86%E5%A4%A7%E8%BD%A9TG%3A%40TC2397431747]-WS%E4%B8%80%E9%94%AE%E7%A7%81%E4%BF%A1%2FWs%E6%89%B9%E9%87%8F%E5%8F%91%E9%80%81%2FWS%E8%90%A5%E9%94%80%E8%BD%AF%E4%BB%B6.kboy&hl=zh-cn
site:instagram.com #economicreconciliation,"Jan 10, 2025",Call for speakers! We are seeking visionary Indigenous ... - Instagram,ca," Jan 10, 2025  ·  This conference promotes a strengths-based narrative of Indigenous economic growth, design, inclusion, and reconciliation. By uniting leaders ... ",https://www.instagram.com/indigenomics/p/DEqICSINOvb/
site:instagram.com #economicreconciliation,"May 30, 2024","Assembly of First Nations on Instagram: ""AFN National Chief ...",ca," May 30, 2024  ·  AFN National Chief @cindywoodhouse_afn addressed attendees at the 2024 Economic Reconciliation Summit, stating that we must start decolonizing ... ",https://www.instagram.com/assemblyoffirstnations/p/C7muAw1STZX/
site:instagram.com #economicreconciliation,"Nov 30, 2021","Ekosani, chi-miigwech, Marci, many thanks to the Brandon Chamber ...",ca," Nov 30, 2021  ·  Please read this incredible article on this memorable event and conversation: Economic reconciliation explored at Chamber luncheon by Chelsea ... ",https://www.instagram.com/noahwilson_indigenous/p/CW6xZbCg77N/
site:instagram.com #economicreconciliation,"Feb 11, 2025","Nearly 50,000 Indigenous people worked in Canada's ... - Instagram",ca," Feb 11, 2025  ·  Let's continue supporting resource development that benefits ALL Canadians! #IndigenousOpportunities #EconomicReconciliation #NaturalResources ... ",https://www.instagram.com/canadaaction/p/DF8RsHzvI3T/
site:instagram.com #economicreconciliation,"Sep 16, 2024",Bring your leadership to this transformative event ... - Instagram,ca," Sep 16, 2024  ·  ... EconomicReconciliation #CANECON #IndigenousInnovation. Instagram. Log ... economy and advancing economic reconciliation. Let's shape the ... ",https://www.instagram.com/indigenomics/reel/C__nrJaNJVB/
site:instagram.com #economicreconciliation,"Sep 30, 2024",Smith School of Business - Instagram,ca," Sep 30, 2024  ·  10 likes, 0 comments - smithbusiness on September 30, 2024: ""How can businesses contribute to economic reconciliation? ",https://www.instagram.com/smithbusiness/reel/DAiu3I8iH3S/
site:instagram.com #economicreconciliation,"Jan 30, 2025",打开应用,ca," Jan 30, 2025  ·  What to Expect: Hands-on economic reconciliation through LEGO design Strengthening Indigenous economic growth & innovation A creative ... ",https://www.instagram.com/indigenomics/p/DFd4AV5Pvl1/?api=1&hl=zh-cn
site:instagram.com #economicreconciliation,"Mar 10, 2025",Throwback - Instagram,ca," Mar 10, 2025  ·  Indigenomics IMPACT experience is an immersive journey into Indigenous economic reconciliation. Through XR storytelling, digital landscapes, ... ",https://www.instagram.com/hesquiaht/p/DHC_Mb7Rknw/
site:instagram.com #economicreconciliation,"Sep 17, 2024",Be part of the future of the Indigenous economy! Don't ... - Instagram,ca," Sep 17, 2024  ·  Join us this April at the HR MacMillan Space Centre in Vancouver, where we will highlight stories of Indigenous economic reconciliation outcomes ... ",https://www.instagram.com/indigenomics/reel/DAB0S0NMB3D/
site:instagram.com #economicreconciliation,"Sep 29, 2024","This Truth and Reconciliation Day, we are grateful to announce the ...",ca," Sep 29, 2024  ·  ... economic reconciliation. @kebaonish @banginbannock @ravenrising.ca ... EconomicReconciliation #CorporateGifting #IndigenousArtisans ... ",https://www.instagram.com/saulgoodgiftco/reel/DAhHsExx_T_/
site:instagram.com #economicreconciliation,"Nov 8, 2023","Indigenomics on Instagram: ""Join us for an enlightening and ...",ca," Nov 8, 2023  ·  Economic justice means recognizing our inherent rights, fostering economic reconciliation, and creating pathways for economic sovereignty that ... ",https://www.instagram.com/indigenomics/p/CzZG9vwRDPZ/
