name,username,is_verified,body,media-header,text,date,stats,timeline_item,url
,,,,,,,,,
BearsLair_TV,@BearslairT,,"BearsLair_TV@BearslairT8 Nov 2022Is your organization interested in sponsoring a Bears Lair Youth Dream Camp?  If so, email us TODAY!#bearslairyouthcamps#bearslairyouthdreamcampsbearslairtv.com#BearsLairTV#BearsLair#SpiritofCoopetition#Indigenomics#aboriginal#indigenousentrepreneurs",BearsLair_TV@BearslairT8 Nov 2022,"Is your organization interested in sponsoring a Bears Lair Youth Dream Camp?  If so, email us TODAY!#bearslairyouthcamps#bearslairyouthdreamcampsbearslairtv.com#BearsLairTV#BearsLair#SpiritofCoopetition#Indigenomics#aboriginal#indigenousentrepreneurs",8 Nov 2022,,,
BearsLair_TV,@BearslairT,,BearsLair_TV@BearslairT8 Nov 2022Thank you again to our incredible Episode 1 contestants!@malloryyawnghwe#indigenousbox@AlbertaK9@SaplingAndFlintbearslairtv.com#BearsLairTV#BearsLair#SpiritofCoopetition#Indigenomics#aboriginal1,BearsLair_TV@BearslairT8 Nov 2022,Thank you again to our incredible Episode 1 contestants!@malloryyawnghwe#indigenousbox@AlbertaK9@SaplingAndFlintbearslairtv.com#BearsLairTV#BearsLair#SpiritofCoopetition#Indigenomics#aboriginal,8 Nov 2022,1,,
"Carol Anne Hilton, MBA",@Hesquiaht,,"Carol Anne Hilton, MBA@Hesquiaht7 Nov 2022The Indigenomics Institute is hiring!#indigenomics#indigenouseconomy#100billion1217","Carol Anne Hilton, MBA@Hesquiaht7 Nov 2022",The Indigenomics Institute is hiring!#indigenomics#indigenouseconomy#100billion,7 Nov 2022,1217,,
BearsLair_TV,@BearslairT,,BearsLair_TV@BearslairT7 Nov 2022Thank you to our amazing Thunderbird Sponsor#WMBSpecialtybearslairtv.com#BearsLairTV#BearsLair#SpiritofCoopetition#Indigenomics#Indigenouswomen#aboriginal#indigenousentrepreneurs,BearsLair_TV@BearslairT7 Nov 2022,Thank you to our amazing Thunderbird Sponsor#WMBSpecialtybearslairtv.com#BearsLairTV#BearsLair#SpiritofCoopetition#Indigenomics#Indigenouswomen#aboriginal#indigenousentrepreneurs,7 Nov 2022,,,
BearsLair_TV,@BearslairT,,BearsLair_TV@BearslairT7 Nov 2022Congratulations to our Season 1 winners of Bears' Lair TV on@APTNtv@AgriTechNorthbearslairtv.com#BearsLairTV#BearsLair#SpiritofCoopetition#Indigenomics#aboriginal#indigenousentrepreneurs125,BearsLair_TV@BearslairT7 Nov 2022,Congratulations to our Season 1 winners of Bears' Lair TV on@APTNtv@AgriTechNorthbearslairtv.com#BearsLairTV#BearsLair#SpiritofCoopetition#Indigenomics#aboriginal#indigenousentrepreneurs,7 Nov 2022,125,,
BearsLair_TV,@BearslairT,,"BearsLair_TV@BearslairT6 Nov 2022Tune in tonight on@APTNtvto watch the Season Finale of#bearslairtvand find out who wins the $100,000 prize!bearslairtv.com#BearsLairTV#BearsLair#SpiritofCoopetition#Indigenomics#aboriginal#indigenousentrepreneurs1",BearsLair_TV@BearslairT6 Nov 2022,"Tune in tonight on@APTNtvto watch the Season Finale of#bearslairtvand find out who wins the $100,000 prize!bearslairtv.com#BearsLairTV#BearsLair#SpiritofCoopetition#Indigenomics#aboriginal#indigenousentrepreneurs",6 Nov 2022,1,,
Strength of Women,@Leadingwithhsd,,"Strength of Women@Leadingwithhsd6 Nov 2022#IndigenomicsChief@cadmusd#aseatatthetable@Hesquiaht@cowessessfnCadmus@cadmusd4 Nov 2022Cowessess achieved another economic self-sustaining project, a 10 MW solar field located close to Cowessess Gas and Grocery 2 near Regina. Cowessess will sell power generated back to the SaskPower grid. A gathering for Cowessess will be Tuesday and a public announcement next day",Strength of Women@Leadingwithhsd6 Nov 2022,#IndigenomicsChief@cadmusd#aseatatthetable@Hesquiaht@cowessessfn,6 Nov 2022,,,
Strength of Women,@Leadingwithhsd,,Strength of Women@Leadingwithhsd6 Nov 2022Essential read:#Indigenomicsby@Hesquiaht#indigenouswaysofknowing#INDIGENOUS#worldview#seatsattheeconomictable#riskofdoingnothingIllusion 2: Why don't they just get over it? Debunk on page 123.#truthtowardshealingandreconciliation11,Strength of Women@Leadingwithhsd6 Nov 2022,Essential read:#Indigenomicsby@Hesquiaht#indigenouswaysofknowing#INDIGENOUS#worldview#seatsattheeconomictable#riskofdoingnothingIllusion 2: Why don't they just get over it? Debunk on page 123.#truthtowardshealingandreconciliation,6 Nov 2022,11,,
Strength of Women,@Leadingwithhsd,,Strength of Women@Leadingwithhsd6 Nov 2022Essential read:#Indigenomicsby@Hesquiaht#indigenouswaysofknowing#INDIGENOUS#worldview#seatsattheeconomictable#riskofdoingnothingIllusion 2: Why don't they just get over it? Debunk on page 123.#truthtowardshealingandreconciliation1,Strength of Women@Leadingwithhsd6 Nov 2022,Essential read:#Indigenomicsby@Hesquiaht#indigenouswaysofknowing#INDIGENOUS#worldview#seatsattheeconomictable#riskofdoingnothingIllusion 2: Why don't they just get over it? Debunk on page 123.#truthtowardshealingandreconciliation,6 Nov 2022,1,,
BearsLair_TV,@BearslairT,,BearsLair_TV@BearslairT5 Nov 2022Thank you to our Abalone Sponsor@InBCInvestmentbearslairtv.com#BearsLairTV#BearsLair#SpiritofCoopetition#Indigenomics#aboriginal#indigenousentrepreneurs1,BearsLair_TV@BearslairT5 Nov 2022,Thank you to our Abalone Sponsor@InBCInvestmentbearslairtv.com#BearsLairTV#BearsLair#SpiritofCoopetition#Indigenomics#aboriginal#indigenousentrepreneurs,5 Nov 2022,1,,
Don Richardson,@Don_Richardson,,"Don Richardson@Don_Richardson5 Nov 2022Batchewana First Nation launches telecom company - Batchewana Telecom, aims to provide affordable high-speed internet, phone and TV service to Indigenous and rural communities across Canada.northernontario.ctvnews.ca/b…#Indigenomics3211",Don Richardson@Don_Richardson5 Nov 2022,"Batchewana First Nation launches telecom company - Batchewana Telecom, aims to provide affordable high-speed internet, phone and TV service to Indigenous and rural communities across Canada.northernontario.ctvnews.ca/b…#Indigenomics",5 Nov 2022,3211,,
Treaty One,@treatyonenation,,"Treaty One@treatyonenation4 Nov 202220+ YRS IN THE MAKING! ✊🏼

Final Addition to Reserve documents were submitted today by#TreatyOne, meaning development of the Naawi-Oodena Economic Development Zone can soon proceed on lands of the former Kapyong Barracks in#Winnipeg!#treaty1#firstnations#canada#indigenomics1726",Treaty One@treatyonenation4 Nov 2022,"20+ YRS IN THE MAKING! ✊🏼

Final Addition to Reserve documents were submitted today by#TreatyOne, meaning development of the Naawi-Oodena Economic Development Zone can soon proceed on lands of the former Kapyong Barracks in#Winnipeg!#treaty1#firstnations#canada#indigenomics",4 Nov 2022,1726,,
"Carol Anne Hilton, MBA",@Hesquiaht,,"Carol Anne Hilton, MBA@Hesquiaht4 Nov 2022Truly honored to receive the Mastercard Game Changer Indigenous Entrepreneur 2022 Award from Powwow Pitch! Congrats to all this years recipients!#indigenousbusiness#indigenousentrepreneurship#indigenomics#100billion83561","Carol Anne Hilton, MBA@Hesquiaht4 Nov 2022",Truly honored to receive the Mastercard Game Changer Indigenous Entrepreneur 2022 Award from Powwow Pitch! Congrats to all this years recipients!#indigenousbusiness#indigenousentrepreneurship#indigenomics#100billion,4 Nov 2022,83561,,
BearsLair_TV,@BearslairT,,"BearsLair_TV@BearslairT4 Nov 2022Is your organization interested in sponsoring a Bears Lair Youth Dream Camp? If so, email us TODAY!#bearslairyouthcamps#bearslairyouthdreamcampsbearslairtv.com#BearsLairTV#BearsLair#SpiritofCoopetition#Indigenomics#aboriginal#indigenousentrepreneurs1",BearsLair_TV@BearslairT4 Nov 2022,"Is your organization interested in sponsoring a Bears Lair Youth Dream Camp? If so, email us TODAY!#bearslairyouthcamps#bearslairyouthdreamcampsbearslairtv.com#BearsLairTV#BearsLair#SpiritofCoopetition#Indigenomics#aboriginal#indigenousentrepreneurs",4 Nov 2022,1,,
Coast Funds,@coastfunds,,"Coast Funds@coastfunds4 Nov 2022We're throwing it back to the Gwa’sala-‘Nakwaxda’xw Nation's opening of their Kwa’lilas Hotel, a game-changing#economicventure for its people. 🏨ow.ly/YRVA50Flaq8#Indigenomics12",Coast Funds@coastfunds4 Nov 2022,"We're throwing it back to the Gwa’sala-‘Nakwaxda’xw Nation's opening of their Kwa’lilas Hotel, a game-changing#economicventure for its people. 🏨ow.ly/YRVA50Flaq8#Indigenomics",4 Nov 2022,12,,
BearsLair_TV,@BearslairT,,BearsLair_TV@BearslairT4 Nov 2022Thank you to our Thunderbird Sponsor#Tuccarobearslairtv.com#BearsLairTV#BearsLair#SpiritofCoopetition#Indigenomics#aboriginal#indigenousentrepreneurs,BearsLair_TV@BearslairT4 Nov 2022,Thank you to our Thunderbird Sponsor#Tuccarobearslairtv.com#BearsLairTV#BearsLair#SpiritofCoopetition#Indigenomics#aboriginal#indigenousentrepreneurs,4 Nov 2022,,,
BearsLair_TV,@BearslairT,,"BearsLair_TV@BearslairT3 Nov 2022Is your organization interested in sponsoring a Bears Lair Youth Dream Camp? If so, email us TODAY!#bearslairyouthcamps#bearslairyouthdreamcampsbearslairtv.com#BearsLairTV#BearsLair#SpiritofCoopetition#Indigenomics#aboriginal#indigenousentrepreneurs11",BearsLair_TV@BearslairT3 Nov 2022,"Is your organization interested in sponsoring a Bears Lair Youth Dream Camp? If so, email us TODAY!#bearslairyouthcamps#bearslairyouthdreamcampsbearslairtv.com#BearsLairTV#BearsLair#SpiritofCoopetition#Indigenomics#aboriginal#indigenousentrepreneurs",3 Nov 2022,11,,
"Carol Anne Hilton, MBA",@Hesquiaht,,"Carol Anne Hilton, MBA@Hesquiaht3 Nov 2022#indigenomicsin actionMichael Fox, MBA@Indigenous_ICE3 Nov 2022Infrastructure Bank backs Indigenous wastewater facility with $6.4-million loan.lnkd.in/gwsChjv8#indigenous2","Carol Anne Hilton, MBA@Hesquiaht3 Nov 2022",#indigenomicsin action,3 Nov 2022,2,,
BearsLair_TV,@BearslairT,,BearsLair_TV@BearslairT3 Nov 2022Thank you to our copper sponsors@HorizonOffshorebearslairtv.com#BearsLairTV#BearsLair#SpiritofCoopetition#Indigenomics#aboriginal#indigenousentrepreneurs,BearsLair_TV@BearslairT3 Nov 2022,Thank you to our copper sponsors@HorizonOffshorebearslairtv.com#BearsLairTV#BearsLair#SpiritofCoopetition#Indigenomics#aboriginal#indigenousentrepreneurs,3 Nov 2022,,,
BearsLair_TV,@BearslairT,,BearsLair_TV@BearslairT2 Nov 2022Thank you to our thunderbird Sponsor#SpiritWorksbearslairtv.com#BearsLairTV#BearsLair#SpiritofCoopetition#Indigenomics#Indigenouswomen#aboriginal#indigenousentrepreneurs,BearsLair_TV@BearslairT2 Nov 2022,Thank you to our thunderbird Sponsor#SpiritWorksbearslairtv.com#BearsLairTV#BearsLair#SpiritofCoopetition#Indigenomics#Indigenouswomen#aboriginal#indigenousentrepreneurs,2 Nov 2022,,,
