name,username,is_verified,body,media-header,text,date,stats,timeline_item,url
,,,,,,,,,
inPath,@_inPath_,,"inPath@_inPath_2 Nov 2022Members of our team are at the inaugural Indigenomics SHE conference in Vancouver, and are sharing highlights of the conversations that are taking place around women in business, leadership, and generating financial and holistic wealth!#indigenomics#indgenomicsSHE#leadership112",inPath@_inPath_2 Nov 2022,"Members of our team are at the inaugural Indigenomics SHE conference in Vancouver, and are sharing highlights of the conversations that are taking place around women in business, leadership, and generating financial and holistic wealth!#indigenomics#indgenomicsSHE#leadership",2 Nov 2022,112,,
Coeuraj,@Coeuraj,,"Coeuraj@Coeuraj2 Nov 2022Recently, our team was joined by#Indigenomicsauthor@Hesquiahtfor a presentation and team Q&A to talk about the principles of economic#reconciliation.

It was a rich conversation and learning experience. Many thanks to Carol Anne for sharing her knowledge with us!2",Coeuraj@Coeuraj2 Nov 2022,"Recently, our team was joined by#Indigenomicsauthor@Hesquiahtfor a presentation and team Q&A to talk about the principles of economic#reconciliation.

It was a rich conversation and learning experience. Many thanks to Carol Anne for sharing her knowledge with us!",2 Nov 2022,2,,
BearsLair_TV,@BearslairT,,BearsLair_TV@BearslairT1 Nov 2022Thank you to our Thunderbird sponsor@Shopify#BearsLairTV#BearsLair#SpiritofCoopetition#Indigenomics#aboriginal#indigenousentrepreneursbearslairtv.com,BearsLair_TV@BearslairT1 Nov 2022,Thank you to our Thunderbird sponsor@Shopify#BearsLairTV#BearsLair#SpiritofCoopetition#Indigenomics#aboriginal#indigenousentrepreneursbearslairtv.com,1 Nov 2022,,,
Earnscliffe Strategies,@EarnscliffeCda,,Earnscliffe Strategies@EarnscliffeCda1 Nov 2022Earnscliffe is a proud sponsor of the inaugural#IndigenomicsSHEconference uplifting Indigenous womxn's leadership & creating a space for the vision of womxn’s participation in the Indigenous economy#Indigenomics#WomeninBusinessindigenomicsinstitute.comNov 1 & 2 - Vancouver1214,Earnscliffe Strategies@EarnscliffeCda1 Nov 2022,Earnscliffe is a proud sponsor of the inaugural#IndigenomicsSHEconference uplifting Indigenous womxn's leadership & creating a space for the vision of womxn’s participation in the Indigenous economy#Indigenomics#WomeninBusinessindigenomicsinstitute.comNov 1 & 2 - Vancouver,1 Nov 2022,1214,,
BearsLair_TV,@BearslairT,,BearsLair_TV@BearslairT1 Nov 2022Congratulations to our semi-finalists@AgriTechNorth#BearsLairTV#BearsLair#SpiritofCoopetition#Indigenomics#aboriginalbearslairtv.com,BearsLair_TV@BearslairT1 Nov 2022,Congratulations to our semi-finalists@AgriTechNorth#BearsLairTV#BearsLair#SpiritofCoopetition#Indigenomics#aboriginalbearslairtv.com,1 Nov 2022,,,
BearsLair_TV,@BearslairT,,BearsLair_TV@BearslairT31 Oct 2022Thank you to our Thunderbird Sponsor@Bruce_Power#BearsLairTV#BearsLair#SpiritofCoopetition#Indigenomics#Indigenouswomen#aboriginal#indigenousentrepreneursbearslairtv.com,BearsLair_TV@BearslairT31 Oct 2022,Thank you to our Thunderbird Sponsor@Bruce_Power#BearsLairTV#BearsLair#SpiritofCoopetition#Indigenomics#Indigenouswomen#aboriginal#indigenousentrepreneursbearslairtv.com,31 Oct 2022,,,
BearsLair_TV,@BearslairT,,"BearsLair_TV@BearslairT31 Oct 2022Thank you to our Thunderbird sponsors@NACCAinfo,@indigenomics,@securiguard,#ohkwariand our Episode 9 Season Finale Guest Judges!#BearsLairTV#BearsLair#SpiritofCoopetition#Indigenomics#aboriginal#indigenousentrepreneursbearslairtv.com11",BearsLair_TV@BearslairT31 Oct 2022,"Thank you to our Thunderbird sponsors@NACCAinfo,@indigenomics,@securiguard,#ohkwariand our Episode 9 Season Finale Guest Judges!#BearsLairTV#BearsLair#SpiritofCoopetition#Indigenomics#aboriginal#indigenousentrepreneursbearslairtv.com",31 Oct 2022,11,,
BearsLair_TV,@BearslairT,,BearsLair_TV@BearslairT30 Oct 2022Tune in tonight and watch as our Bears' do one-on-one coaching with the semi-finalists! @ccab_national@IndigenousWine#Tuccaro#BearsLairTV#BearsLair#SpiritofCoopetition#Indigenomics#aboriginal#indigenousentrepreneursbearslairtv.com112,BearsLair_TV@BearslairT30 Oct 2022,Tune in tonight and watch as our Bears' do one-on-one coaching with the semi-finalists! @ccab_national@IndigenousWine#Tuccaro#BearsLairTV#BearsLair#SpiritofCoopetition#Indigenomics#aboriginal#indigenousentrepreneursbearslairtv.com,30 Oct 2022,112,,
BearsLair_TV,@BearslairT,,BearsLair_TV@BearslairT29 Oct 2022Thank you to our copper sponsors Bennett Mechanical and@HorizonOffshore#BearsLairTV#BearsLair#SpiritofCoopetition#Indigenomics#aboriginal#indigenousentrepreneursbearslairtv.com,BearsLair_TV@BearslairT29 Oct 2022,Thank you to our copper sponsors Bennett Mechanical and@HorizonOffshore#BearsLairTV#BearsLair#SpiritofCoopetition#Indigenomics#aboriginal#indigenousentrepreneursbearslairtv.com,29 Oct 2022,,,
Don Richardson,@Don_Richardson,,"Don Richardson@Don_Richardson28 Oct 2022Federal Natural Resources Minister looks to speed up critical minerals production - ""Talk also turned toward#IndigenousEquityin resource projects... as a means to achieve economic reconciliation""sudbury.com/beyond-local/fed…#Indigenomics9315",Don Richardson@Don_Richardson28 Oct 2022,"Federal Natural Resources Minister looks to speed up critical minerals production - ""Talk also turned toward#IndigenousEquityin resource projects... as a means to achieve economic reconciliation""sudbury.com/beyond-local/fed…#Indigenomics",28 Oct 2022,9315,,
"Carol Anne Hilton, MBA",@Hesquiaht,,"Carol Anne Hilton, MBA@Hesquiaht27 Oct 2022#indigenomics#100billion#indigenouseconomy#cdnecon#bceconReconciliation Matters@Rec_Matters27 Oct 2022Largest Indigenous-led economic project in Canadian history underway in Vancouver@SquamishNation@nchkaycorpcanada.constructconnect.com/…25","Carol Anne Hilton, MBA@Hesquiaht27 Oct 2022",#indigenomics#100billion#indigenouseconomy#cdnecon#bcecon,27 Oct 2022,25,,
BearsLair_TV,@BearslairT,,BearsLair_TV@BearslairT27 Oct 2022Thank you to our Thunderbird Sponsor@Vancity#BearsLairTV#BearsLair#SpiritofCoopetition#Indigenomics#aboriginal#indigenousentrepreneursbearslairtv.com1,BearsLair_TV@BearslairT27 Oct 2022,Thank you to our Thunderbird Sponsor@Vancity#BearsLairTV#BearsLair#SpiritofCoopetition#Indigenomics#aboriginal#indigenousentrepreneursbearslairtv.com,27 Oct 2022,1,,
BearsLair_TV,@BearslairT,,"BearsLair_TV@BearslairT27 Oct 2022Is your organization interested in sponsoring a Bears Lair Youth Dream Camp?  If so, email us TODAY!#bearslairyouthcamps#bearslairyouthdreamcamps#BearsLairTV#BearsLair#SpiritofCoopetition#Indigenomics#aboriginal#indigenousentrepreneursbearslairtv.com",BearsLair_TV@BearslairT27 Oct 2022,"Is your organization interested in sponsoring a Bears Lair Youth Dream Camp?  If so, email us TODAY!#bearslairyouthcamps#bearslairyouthdreamcamps#BearsLairTV#BearsLair#SpiritofCoopetition#Indigenomics#aboriginal#indigenousentrepreneursbearslairtv.com",27 Oct 2022,,,
BearsLair_TV,@BearslairT,,BearsLair_TV@BearslairT27 Oct 2022Thank you to our copper sponsors First Nations University and@TheEcoraGroup#BearsLairTV#BearsLair#SpiritofCoopetition#Indigenomics#aboriginal#indigenousentrepreneursbearslairtv.com,BearsLair_TV@BearslairT27 Oct 2022,Thank you to our copper sponsors First Nations University and@TheEcoraGroup#BearsLairTV#BearsLair#SpiritofCoopetition#Indigenomics#aboriginal#indigenousentrepreneursbearslairtv.com,27 Oct 2022,,,
"Carol Anne Hilton, MBA",@Hesquiaht,,"Carol Anne Hilton, MBA@Hesquiaht27 Oct 2022The original economy ##yyj#indigenomicsSonghees Nation@SongheesNation26 Oct 2022Potlatch at Songhees village 1872. The roofs of the big houses are lined with blankets to be gifted, Chief Sqwameyuqs will gift a canoe to each of the visiting Chiefs. The mat-covered structure against one of the houses conceals dancers waiting to perform. Canoes line the shore.2","Carol Anne Hilton, MBA@Hesquiaht27 Oct 2022",The original economy ##yyj#indigenomics,27 Oct 2022,2,,
BearsLair_TV,@BearslairT,,BearsLair_TV@BearslairT26 Oct 2022Tune in and watch our semi finalist June Anthony-Reeves from Up the Hill at Loakin Botanicals#BearsLairTV#BearsLair#SpiritofCoopetition#Indigenomics#aboriginal#indigenousentrepreneursbearslairtv.com,BearsLair_TV@BearslairT26 Oct 2022,Tune in and watch our semi finalist June Anthony-Reeves from Up the Hill at Loakin Botanicals#BearsLairTV#BearsLair#SpiritofCoopetition#Indigenomics#aboriginal#indigenousentrepreneursbearslairtv.com,26 Oct 2022,,,
BearsLair_TV,@BearslairT,,BearsLair_TV@BearslairT26 Oct 2022Thank you to our Thunderbird Sponsor@PaperExcellence#BearsLairTV#BearsLair#SpiritofCoopetition#Indigenomics#Indigenouswomen#aboriginal#indigenousentrepreneursbearslairtv.com,BearsLair_TV@BearslairT26 Oct 2022,Thank you to our Thunderbird Sponsor@PaperExcellence#BearsLairTV#BearsLair#SpiritofCoopetition#Indigenomics#Indigenouswomen#aboriginal#indigenousentrepreneursbearslairtv.com,26 Oct 2022,,,
Don Richardson,@Don_Richardson,,Don Richardson@Don_Richardson26 Oct 2022Largest Indigenous-led economic project in Canadian history underway in Vancouver#Indigenomicscanada.constructconnect.com/…2,Don Richardson@Don_Richardson26 Oct 2022,Largest Indigenous-led economic project in Canadian history underway in Vancouver#Indigenomicscanada.constructconnect.com/…,26 Oct 2022,2,,
BearsLair_TV,@BearslairT,,BearsLair_TV@BearslairT25 Oct 2022Thank you to our Thunderbird Sponsor#SunspearRenewables#BearsLairTV#BearsLair#SpiritofCoopetition#Indigenomics#aboriginal#indigenousentrepreneursbearslairtv.com,BearsLair_TV@BearslairT25 Oct 2022,Thank you to our Thunderbird Sponsor#SunspearRenewables#BearsLairTV#BearsLair#SpiritofCoopetition#Indigenomics#aboriginal#indigenousentrepreneursbearslairtv.com,25 Oct 2022,,,
BearsLair_TV,@BearslairT,,"BearsLair_TV@BearslairT24 Oct 2022Thank you to our incredible Abalone Sponsors Agentic Digital Media, Falkus Media and@InBCInvestment#BearsLairTV#BearsLair#SpiritofCoopetition#Indigenomics#aboriginal#indigenousentrepreneurs1",BearsLair_TV@BearslairT24 Oct 2022,"Thank you to our incredible Abalone Sponsors Agentic Digital Media, Falkus Media and@InBCInvestment#BearsLairTV#BearsLair#SpiritofCoopetition#Indigenomics#aboriginal#indigenousentrepreneurs",24 Oct 2022,1,,
